{
  "schema_version": "arcana.loss.v1",
  "risk_model_version": "arcana.risk.v0.2",
  "calibration_profile_id": "arcana.cal.synthetic_a1_loss",
  "decision_horizon": {
    "id": "synthetic_5m",
    "duration_seconds": 300,
    "context": "synthetic loss contract example"
  },
  "unit": "synthetic_eur",
  "method": "dkw_empirical_upper",
  "failure_probability_upper": 0.05,
  "evidence_hash": "sha256:6666666666666666666666666666666666666666666666666666666666666666",
  "evidence_source_id": "synthetic-loss-sample-v1",
  "source_kind": "synthetic_fixture",
  "valid_from": "2026-06-09T00:00:00Z",
  "expires_at": "2026-06-10T00:00:00Z",
  "alpha": 0.99,
  "quantile_convention": "lower_quantile_integral",
  "sample": [
    94.58,
    98.58,
    240.75,
    4.57,
    189.15,
    107.33,
    36.45,
    37.77,
    49.73,
    63.83,
    466.84,
    19.23,
    10.4,
    40.12,
    134.25,
    304.75,
    69.84,
    64.63,
    47.0,
    452.78,
    79.44,
    59.92,
    178.94,
    24.45,
    114.02,
    43.43,
    285.6,
    56.67,
    112.03,
    261.24,
    120.81,
    0.59,
    295.3,
    23.91,
    36.88,
    101.19,
    27.07,
    16.63,
    145.87,
    12.74,
    78.63,
    9.07,
    305.9,
    60.16,
    106.67,
    281.07,
    32.13,
    10.74,
    160.61,
    317.06,
    8.97,
    684.05,
    13.19,
    68.3,
    37.61,
    30.18,
    45.3,
    226.63,
    107.72,
    35.41,
    215.03,
    88.46,
    26.97,
    92.78
  ],
  "support_upper": 1000.0,
  "binding_hash": "sha256:2fa780607def077dbf488523934503ec0ba63492de5ea5945ff668f68826456d"
}
